{
  "id": "ep00",
  "number": 0,
  "title": "حَلْقَةٌ تَجْرِيبِيَّةٌ",
  "hero": { "name": "اختبار خط الإنتاج", "era": "—" },
  "target_seconds": 120,
  "cast": {
    "narrator": { "role": "الراوي" },
    "hero": { "role": "البطل" }
  },
  "scenes": [
    {
      "id": "s01",
      "part": "story",
      "setting": "مَخْطُوطَةٌ تَنْفَتِحُ عَلَى صَحْرَاءَ عِنْدَ الْفَجْرِ",
      "layers": ["sky_dawn", "dunes", "popup_frame"],
      "lines": [
        {
          "speaker": "narrator",
          "text_diacritized": "فِي قَدِيمِ الزَّمَانِ، عَاشَ بَطَلٌ شُجَاعٌ.",
          "sfx": ["page_turn", "wind_soft"],
          "visual_beat": "popup: the manuscript page unrolls; gold illumination draws the title frame"
        },
        {
          "speaker": "hero",
          "text_diacritized": "سَأَحْمِي مَدِينَتِي مَهْمَا كَانَ الثَّمَنُ.",
          "sfx": ["footsteps"],
          "visual_beat": "popup: hero silhouette rises from the near dune layer; parallax drift"
        }
      ]
    }
  ]
}
